{
  "specVersion": "0.1",
  "id": "wp_recon_reviewed",
  "engagementId": "eng_min",
  "reference": "A-1",
  "title": "Operating account reconciliation - May",
  "kind": "reconciliation",
  "status": "reviewed",
  "period": { "label": "2026-05", "start": "2026-05-01", "end": "2026-05-31" },
  "preparedBy": { "id": "stf_jordan", "name": "Jordan Lee", "role": "preparer" },
  "preparedAt": "2026-06-04T15:20:00Z",
  "reviewedBy": { "id": "stf_morgan", "name": "Morgan Diaz", "role": "reviewer" },
  "reviewedAt": "2026-06-06T13:05:00Z",
  "tieOut": {
    "balance": { "amount": "48210.55", "currency": "USD" },
    "supportingTotal": { "amount": "48210.55", "currency": "USD" },
    "agrees": true
  },
  "requestItemIds": ["rli_may_bank_stmt"]
}
